{
  "$schema": "https://json-schema.org/draft/2020-12/schema",
  "$id": "https://opensynd.example/schema/mission-v1.json",
  "$comment": "SPDX-License-Identifier: GPL-2.0-or-later",
  "title": "OpenSynd mission",
  "type": "object",
  "additionalProperties": false,
  "required": ["formatVersion", "id", "name", "license", "briefing", "map", "team", "opponents", "objectives"],
  "properties": {
    "formatVersion": { "const": 1 },
    "id": { "$ref": "#/$defs/id" },
    "name": { "type": "string", "minLength": 1, "maxLength": 80 },
    "license": { "enum": ["CC0-1.0", "CC-BY-4.0"] },
    "briefing": { "type": "string", "minLength": 1, "maxLength": 2000 },
    "title": { "type": "string", "minLength": 1, "maxLength": 120, "description": "Headline shown when the operation succeeds." },
    "story": { "type": "string", "minLength": 1, "maxLength": 2000, "description": "Opening text on the title screen." },
    "debrief": {
      "type": "object",
      "additionalProperties": false,
      "required": ["success", "failure"],
      "properties": {
        "success": { "type": "string", "minLength": 1, "maxLength": 1000 },
        "failure": { "type": "string", "minLength": 1, "maxLength": 1000 }
      }
    },
    "region": {
      "type": "object",
      "additionalProperties": false,
      "required": ["name", "lon", "lat"],
      "description": "Where this operation sits on the world map used to choose it: a place name and a real-world longitude and latitude.",
      "properties": {
        "name": { "type": "string", "minLength": 1, "maxLength": 60 },
        "population": { "type": "integer", "minimum": 100000, "maximum": 50000000, "description": "People living here; the base for tax income." },
        "lon": { "type": "number", "minimum": -180, "maximum": 180 },
        "lat": { "type": "number", "minimum": -58, "maximum": 84, "description": "The atlas shows 84 degrees north to 58 degrees south." }
      }
    },
    "intel": {
      "type": "array", "maxItems": 2,
      "items": { "type": "string", "minLength": 1, "maxLength": 400 },
      "description": "Extra briefing lines that each survey level adds, in order."
    },
    "unlocks": {
      "type": "array", "uniqueItems": true, "items": { "$ref": "#/$defs/id" },
      "description": "Operations (by id) that open when this one is won. If no operation in a pack lists any, they open as a chain."
    },
    "sequence": { "type": "boolean", "description": "When true the required objectives must be done in the order listed; the briefing points at the one to do now." },
    "variant": {
      "enum": ["uprising", "defence"],
      "description": "Which of a territory's other operations this is: the uprising, played when it is in revolt, or the defence, played when a rival company moves to take it. Absent on a territory's main operation."
    },
    "territory": { "$ref": "#/$defs/id", "description": "For an uprising or defence: the id of the territory's main operation, which names the territory." },
    "map": { "$ref": "#/$defs/path" },
    "zones": {
      "type": "array",
      "description": "Zones this mission adds to its map's own (an area to fall back to, say), in the same shape as the map's zones.",
      "items": { "type": "object", "required": ["id", "kind", "position", "width", "height"] }
    },
    "team": { "type": "array", "minItems": 1, "maxItems": 4, "items": { "$ref": "#/$defs/placement" } },
    "opponents": { "type": "array", "items": { "$ref": "#/$defs/placement" } },
    "vehicles": {
      "type": "array",
      "items": { "$ref": "#/$defs/vehiclePlacement" },
      "description": "Cars and vans on the roads. Each may have a driver who drives it along its route."
    },
    "bystanders": {
      "type": "array",
      "items": { "$ref": "#/$defs/placement" },
      "description": "Civilians and police who share the streets. They are neutral until an operator gives police a reason to act."
    },
    "objectives": { "type": "array", "minItems": 1, "items": { "$ref": "#/$defs/objective" } }
  },
  "$defs": {
    "id": { "type": "string", "pattern": "^[a-z][a-z0-9]*(?:[.-][a-z0-9]+)*$" },
    "path": { "type": "string", "pattern": "^[a-zA-Z0-9_./-]+\\.json$" },
    "position": {
      "type": "object",
      "additionalProperties": false,
      "required": ["x", "y"],
      "properties": {
        "x": { "type": "integer", "minimum": 0 },
        "y": { "type": "integer", "minimum": 0 }
      }
    },
    "placement": {
      "type": "object",
      "additionalProperties": false,
      "required": ["id", "unit", "position", "equipment"],
      "properties": {
        "id": { "$ref": "#/$defs/id" },
        "unit": { "$ref": "#/$defs/path" },
        "position": { "$ref": "#/$defs/position" },
        "equipment": { "$ref": "#/$defs/pathList" },
        "patrol": {
          "type": "array",
          "description": "Waypoints an opposition unit walks after its start, returning to the start and repeating.",
          "minItems": 1,
          "items": { "$ref": "#/$defs/position" }
        },
        "script": {
          "type": "array",
          "description": "Steps this person follows instead of a patrol: walk, wait, trigger (wait for an operator to come near), say (speak a line), escape (walk off the map), enter (walk to a vehicle and get in as its driver), drive (take it to a point on the roads) and leave (get out).",
          "minItems": 1,
          "maxItems": 40,
          "items": { "$ref": "#/$defs/scriptStep" }
        },
        "scriptLoop": { "type": "boolean", "description": "Start the script again when it ends." }
      }
    },
    "scriptStep": {
      "type": "object",
      "required": ["type"],
      "properties": {
        "type": { "enum": ["walk", "wait", "trigger", "escape", "say", "enter", "drive", "leave"] },
        "vehicle": { "$ref": "#/$defs/id", "description": "For enter: the id of the vehicle to get into." },
        "text": { "type": "string", "minLength": 1, "maxLength": 200 },
        "to": { "$ref": "#/$defs/position" },
        "seconds": { "type": "number", "exclusiveMinimum": 0, "maximum": 600 },
        "at": { "$ref": "#/$defs/position" },
        "radius": { "type": "number", "exclusiveMinimum": 0, "maximum": 60 }
      },
      "additionalProperties": false
    },
    "pathList": {
      "type": "array",
      "items": { "$ref": "#/$defs/path" },
      "uniqueItems": true
    },
    "vehiclePlacement": {
      "type": "object",
      "additionalProperties": false,
      "required": ["id", "vehicle", "position"],
      "properties": {
        "id": { "$ref": "#/$defs/id" },
        "vehicle": { "$ref": "#/$defs/path" },
        "position": { "$ref": "#/$defs/position" },
        "driver": { "$ref": "#/$defs/path", "description": "The unit definition of the person at the wheel, if any." },
        "patrol": {
          "type": "array",
          "description": "Waypoints along the roads the driver follows, returning to the start and repeating.",
          "minItems": 1,
          "items": { "$ref": "#/$defs/position" }
        },
        "stops": {
          "type": "array",
          "description": "A train: the stations it runs between, in order and back again; it waits at each for `wait` seconds.",
          "minItems": 2,
          "items": {
            "type": "object",
            "additionalProperties": false,
            "required": ["x", "y"],
            "properties": {
              "x": { "type": "integer", "minimum": 0 },
              "y": { "type": "integer", "minimum": 0 },
              "wait": { "type": "number", "minimum": 0, "maximum": 120 }
            }
          }
        }
      }
    },
    "objective": {
      "type": "object",
      "additionalProperties": false,
      "required": ["id", "type", "required", "description"],
      "properties": {
        "id": { "$ref": "#/$defs/id" },
        "type": {
          "enum": [
            "reach-zone", "interact", "protect", "disable", "hold", "extract",
            "persuade", "eliminate", "destroy-vehicle", "use-vehicle", "take-item", "evacuate"
          ],
          "description": "protect: named people stand in the zone alive (an escort; losing one fails the operation). persuade: named people follow the squad. eliminate: everyone in a group is down or won over. destroy-vehicle / use-vehicle: named vehicles. take-item: an operator carries `item`. evacuate: persuaded followers stand in the zone."
        },
        "group": { "type": "string", "minLength": 1, "maxLength": 40, "description": "eliminate: a side or unit role such as opposition, guard or enemy-agent." },
        "count": { "type": "integer", "minimum": 1, "maximum": 99, "description": "persuade, evacuate: how many are enough." },
        "item": { "$ref": "#/$defs/id", "description": "take-item: the equipment id to carry." },
        "targetZone": { "$ref": "#/$defs/id", "description": "The zone to reach, use, hold or extract through. Not used by disable." },
        "targets": {
          "type": "array",
          "minItems": 1,
          "items": { "$ref": "#/$defs/id" },
          "description": "The placements (or vehicles) the objective is about; disable needs opposition placements, all of which must be disabled and not got away."
        },
        "holdSeconds": { "type": "number", "exclusiveMinimum": 0, "description": "hold: seconds an operator must stay in the zone." },
        "required": { "type": "boolean" },
        "description": { "type": "string", "minLength": 1, "maxLength": 240 }
      }
    }
  }
}
