{
 "formatVersion": 1,
 "id": "developer.op-amazon-basin-uprising",
 "name": "Amazon Basin Relay Run Uprising",
 "license": "CC0-1.0",
 "map": "maps/amazon-basin.map.json",
 "team": [
  {
   "id": "operator-one",
   "unit": "units/field-operator.unit.json",
   "position": {
    "x": 2,
    "y": 48
   },
   "equipment": [
    "equipment/civic-pulse-emitter.equipment.json",
    "equipment/field-repair-kit.equipment.json"
   ]
  },
  {
   "id": "operator-two",
   "unit": "units/field-operator.unit.json",
   "position": {
    "x": 3,
    "y": 48
   },
   "equipment": [
    "equipment/civic-pulse-emitter.equipment.json",
    "equipment/field-repair-kit.equipment.json"
   ]
  },
  {
   "id": "operator-three",
   "unit": "units/field-operator.unit.json",
   "position": {
    "x": 2,
    "y": 49
   },
   "equipment": [
    "equipment/civic-pulse-emitter.equipment.json",
    "equipment/field-repair-kit.equipment.json"
   ]
  },
  {
   "id": "operator-four",
   "unit": "units/field-operator.unit.json",
   "position": {
    "x": 3,
    "y": 49
   },
   "equipment": [
    "equipment/civic-pulse-emitter.equipment.json",
    "equipment/field-repair-kit.equipment.json"
   ]
  }
 ],
 "opponents": [
  {
   "id": "enemy-agent-one",
   "unit": "units/enemy-agent.unit.json",
   "position": {
    "x": 17,
    "y": 14
   },
   "equipment": [],
   "patrol": [
    {
     "x": 17,
     "y": 14
    },
    {
     "x": 17,
     "y": 21
    }
   ]
  },
  {
   "id": "enemy-agent-two",
   "unit": "units/enemy-agent.unit.json",
   "position": {
    "x": 127,
    "y": 46
   },
   "equipment": [],
   "patrol": [
    {
     "x": 127,
     "y": 46
    },
    {
     "x": 120,
     "y": 46
    }
   ]
  },
  {
   "id": "enemy-agent-three",
   "unit": "units/enemy-agent.unit.json",
   "position": {
    "x": 44,
    "y": 47
   },
   "equipment": [],
   "patrol": [
    {
     "x": 44,
     "y": 47
    },
    {
     "x": 44,
     "y": 55
    }
   ]
  },
  {
   "id": "enemy-agent-four",
   "unit": "units/enemy-agent.unit.json",
   "position": {
    "x": 81,
    "y": 47
   },
   "equipment": [],
   "patrol": [
    {
     "x": 81,
     "y": 47
    },
    {
     "x": 81,
     "y": 53
    }
   ]
  },
  {
   "id": "enemy-agent-five",
   "unit": "units/enemy-agent.unit.json",
   "position": {
    "x": 108,
    "y": 57
   },
   "equipment": [],
   "patrol": [
    {
     "x": 108,
     "y": 57
    },
    {
     "x": 108,
     "y": 50
    }
   ]
  },
  {
   "id": "enemy-agent-six",
   "unit": "units/enemy-agent.unit.json",
   "position": {
    "x": 21,
    "y": 46
   },
   "equipment": [],
   "patrol": [
    {
     "x": 21,
     "y": 46
    },
    {
     "x": 13,
     "y": 46
    }
   ]
  },
  {
   "id": "enemy-agent-seven",
   "unit": "units/enemy-agent.unit.json",
   "position": {
    "x": 4,
    "y": 12
   },
   "equipment": [],
   "patrol": [
    {
     "x": 4,
     "y": 12
    },
    {
     "x": 11,
     "y": 12
    }
   ]
  },
  {
   "id": "guard-1",
   "unit": "units/guard.unit.json",
   "position": {
    "x": 113,
    "y": 13
   },
   "equipment": []
  },
  {
   "id": "guard-2",
   "unit": "units/guard.unit.json",
   "position": {
    "x": 32,
    "y": 11
   },
   "equipment": []
  },
  {
   "id": "guard-3",
   "unit": "units/guard.unit.json",
   "position": {
    "x": 36,
    "y": 49
   },
   "equipment": []
  }
 ],
 "objectives": [
  {
   "id": "put-down-ringleaders",
   "type": "eliminate",
   "targets": [
    "enemy-agent-one",
    "enemy-agent-two",
    "enemy-agent-three"
   ],
   "required": true,
   "description": "Put down the 3 ringleaders."
  },
  {
   "id": "fall-back",
   "type": "extract",
   "targetZone": "fall-back-area",
   "required": true,
   "description": "Fall back to the marked landing area with the whole team."
  }
 ],
 "bystanders": [
  {
   "id": "civilian-1",
   "unit": "units/civilian-woman.unit.json",
   "position": {
    "x": 74,
    "y": 47
   },
   "equipment": [],
   "patrol": [
    {
     "x": 74,
     "y": 47
    },
    {
     "x": 82,
     "y": 47
    }
   ]
  },
  {
   "id": "civilian-2",
   "unit": "units/civilian-man.unit.json",
   "position": {
    "x": 113,
    "y": 46
   },
   "equipment": [],
   "patrol": [
    {
     "x": 113,
     "y": 46
    },
    {
     "x": 106,
     "y": 46
    }
   ]
  },
  {
   "id": "civilian-3",
   "unit": "units/civilian-woman.unit.json",
   "position": {
    "x": 100,
    "y": 48
   },
   "equipment": [],
   "patrol": [
    {
     "x": 100,
     "y": 48
    },
    {
     "x": 100,
     "y": 34
    }
   ]
  },
  {
   "id": "civilian-4",
   "unit": "units/civilian-woman.unit.json",
   "position": {
    "x": 67,
    "y": 47
   },
   "equipment": [],
   "patrol": [
    {
     "x": 67,
     "y": 47
    },
    {
     "x": 67,
     "y": 60
    }
   ]
  },
  {
   "id": "civilian-5",
   "unit": "units/civilian-woman.unit.json",
   "position": {
    "x": 39,
    "y": 46
   },
   "equipment": [],
   "patrol": [
    {
     "x": 39,
     "y": 46
    },
    {
     "x": 39,
     "y": 40
    }
   ]
  },
  {
   "id": "civilian-6",
   "unit": "units/civilian-man.unit.json",
   "position": {
    "x": 51,
    "y": 47
   },
   "equipment": [],
   "patrol": [
    {
     "x": 51,
     "y": 47
    },
    {
     "x": 43,
     "y": 47
    }
   ]
  },
  {
   "id": "civilian-7",
   "unit": "units/civilian-woman.unit.json",
   "position": {
    "x": 59,
    "y": 49
   },
   "equipment": [],
   "patrol": [
    {
     "x": 59,
     "y": 49
    },
    {
     "x": 59,
     "y": 57
    }
   ]
  },
  {
   "id": "civilian-8",
   "unit": "units/civilian-woman.unit.json",
   "position": {
    "x": 104,
    "y": 49
   },
   "equipment": [],
   "patrol": [
    {
     "x": 104,
     "y": 49
    },
    {
     "x": 94,
     "y": 49
    }
   ]
  },
  {
   "id": "civilian-9",
   "unit": "units/civilian-woman.unit.json",
   "position": {
    "x": 105,
    "y": 46
   },
   "equipment": [],
   "patrol": [
    {
     "x": 105,
     "y": 46
    },
    {
     "x": 105,
     "y": 55
    }
   ]
  },
  {
   "id": "civilian-10",
   "unit": "units/civilian-man.unit.json",
   "position": {
    "x": 92,
    "y": 49
   },
   "equipment": [],
   "patrol": [
    {
     "x": 92,
     "y": 49
    },
    {
     "x": 83,
     "y": 49
    }
   ]
  },
  {
   "id": "police-1",
   "unit": "units/city-police.unit.json",
   "position": {
    "x": 54,
    "y": 48
   },
   "equipment": [],
   "patrol": [
    {
     "x": 54,
     "y": 48
    },
    {
     "x": 54,
     "y": 55
    }
   ]
  },
  {
   "id": "police-2",
   "unit": "units/city-police.unit.json",
   "position": {
    "x": 109,
    "y": 47
   },
   "equipment": [],
   "patrol": [
    {
     "x": 109,
     "y": 47
    },
    {
     "x": 121,
     "y": 47
    }
   ]
  },
  {
   "id": "police-3",
   "unit": "units/city-police.unit.json",
   "position": {
    "x": 87,
    "y": 47
   },
   "equipment": [],
   "patrol": [
    {
     "x": 87,
     "y": 47
    },
    {
     "x": 87,
     "y": 57
    }
   ]
  },
  {
   "id": "criminal-1",
   "unit": "units/criminal.unit.json",
   "position": {
    "x": 58,
    "y": 53
   },
   "equipment": [],
   "patrol": [
    {
     "x": 58,
     "y": 53
    },
    {
     "x": 58,
     "y": 43
    }
   ]
  },
  {
   "id": "criminal-2",
   "unit": "units/criminal.unit.json",
   "position": {
    "x": 107,
    "y": 16
   },
   "equipment": [],
   "patrol": [
    {
     "x": 107,
     "y": 16
    },
    {
     "x": 113,
     "y": 16
    }
   ]
  },
  {
   "id": "criminal-3",
   "unit": "units/criminal.unit.json",
   "position": {
    "x": 85,
    "y": 0
   },
   "equipment": [],
   "patrol": [
    {
     "x": 85,
     "y": 0
    },
    {
     "x": 92,
     "y": 0
    }
   ]
  }
 ],
 "region": {
  "name": "Amazon Basin",
  "lon": -62,
  "lat": -5,
  "population": 3600000
 },
 "vehicles": [
  {
   "id": "city-car-1",
   "vehicle": "vehicles/city-car.vehicle.json",
   "position": {
    "x": 2,
    "y": 49
   },
   "driver": "units/civilian-man.unit.json",
   "patrol": [
    {
     "x": 2,
     "y": 49
    },
    {
     "x": 125,
     "y": 49
    }
   ]
  },
  {
   "id": "city-car-2",
   "vehicle": "vehicles/city-car.vehicle.json",
   "position": {
    "x": 2,
    "y": 46
   },
   "driver": "units/civilian-woman.unit.json",
   "patrol": [
    {
     "x": 2,
     "y": 46
    },
    {
     "x": 125,
     "y": 46
    }
   ]
  },
  {
   "id": "city-car-3",
   "vehicle": "vehicles/city-car.vehicle.json",
   "position": {
    "x": 2,
    "y": 47
   },
   "driver": "units/civilian-man.unit.json",
   "patrol": [
    {
     "x": 2,
     "y": 47
    },
    {
     "x": 125,
     "y": 47
    }
   ]
  },
  {
   "id": "city-car-4",
   "vehicle": "vehicles/city-car.vehicle.json",
   "position": {
    "x": 2,
    "y": 48
   },
   "driver": "units/civilian-woman.unit.json",
   "patrol": [
    {
     "x": 2,
     "y": 48
    },
    {
     "x": 125,
     "y": 48
    }
   ]
  }
 ],
 "variant": "uprising",
 "territory": "developer.op-amazon-basin",
 "title": "The district has risen",
 "briefing": "Amazon Basin has risen against you and pays nothing until order is restored. Put down the 3 ringleaders and fall back to the landing area. The crowds will go home once they fall.",
 "story": "Amazon Basin Uprising: taxes too high for too long, and the streets belong to the ringleaders. End it.",
 "debrief": {
  "success": "The ringleaders are down and Amazon Basin goes home. The district is yours again and pays tax once more.",
  "failure": "The team is lost and Amazon Basin stays in revolt. It pays nothing until it is taken back."
 },
 "zones": [
  {
   "id": "fall-back-area",
   "kind": "exit",
   "position": {
    "x": 0,
    "y": 46
   },
   "width": 4,
   "height": 4
  }
 ],
 "intel": [
  "Patrol survey: the rising is led by 3 agents, spread through the district.",
  "Full survey: only the ringleaders count; everyone else will fight if you come near."
 ]
}
