{
 "formatVersion": 1,
 "id": "developer.op-iberia-defence",
 "name": "Iberia Audit Defence",
 "license": "CC0-1.0",
 "map": "maps/iberia.map.json",
 "team": [
  {
   "id": "operator-one",
   "unit": "units/field-operator.unit.json",
   "position": {
    "x": 2,
    "y": 52
   },
   "equipment": [
    "equipment/civic-pulse-emitter.equipment.json",
    "equipment/field-repair-kit.equipment.json"
   ]
  },
  {
   "id": "operator-two",
   "unit": "units/field-operator.unit.json",
   "position": {
    "x": 3,
    "y": 52
   },
   "equipment": [
    "equipment/civic-pulse-emitter.equipment.json",
    "equipment/field-repair-kit.equipment.json"
   ]
  },
  {
   "id": "operator-three",
   "unit": "units/field-operator.unit.json",
   "position": {
    "x": 2,
    "y": 53
   },
   "equipment": [
    "equipment/civic-pulse-emitter.equipment.json",
    "equipment/field-repair-kit.equipment.json"
   ]
  },
  {
   "id": "operator-four",
   "unit": "units/field-operator.unit.json",
   "position": {
    "x": 3,
    "y": 53
   },
   "equipment": [
    "equipment/civic-pulse-emitter.equipment.json",
    "equipment/field-repair-kit.equipment.json"
   ]
  }
 ],
 "opponents": [
  {
   "id": "enemy-agent-one",
   "unit": "units/enemy-agent.unit.json",
   "position": {
    "x": 104,
    "y": 64
   },
   "equipment": [],
   "patrol": [
    {
     "x": 104,
     "y": 64
    },
    {
     "x": 73,
     "y": 85
    }
   ]
  },
  {
   "id": "enemy-agent-two",
   "unit": "units/enemy-agent.unit.json",
   "position": {
    "x": 108,
    "y": 51
   },
   "equipment": [],
   "patrol": [
    {
     "x": 108,
     "y": 51
    },
    {
     "x": 73,
     "y": 85
    }
   ]
  },
  {
   "id": "enemy-agent-three",
   "unit": "units/enemy-agent.unit.json",
   "position": {
    "x": 45,
    "y": 16
   },
   "equipment": [],
   "patrol": [
    {
     "x": 45,
     "y": 16
    },
    {
     "x": 45,
     "y": 10
    }
   ]
  },
  {
   "id": "enemy-agent-four",
   "unit": "units/enemy-agent.unit.json",
   "position": {
    "x": 65,
    "y": 19
   },
   "equipment": [],
   "patrol": [
    {
     "x": 65,
     "y": 19
    },
    {
     "x": 57,
     "y": 19
    }
   ]
  },
  {
   "id": "enemy-agent-five",
   "unit": "units/enemy-agent.unit.json",
   "position": {
    "x": 109,
    "y": 63
   },
   "equipment": [],
   "patrol": [
    {
     "x": 109,
     "y": 63
    },
    {
     "x": 73,
     "y": 85
    }
   ]
  },
  {
   "id": "guard-1",
   "unit": "units/guard.unit.json",
   "position": {
    "x": 123,
    "y": 49
   },
   "equipment": []
  },
  {
   "id": "guard-2",
   "unit": "units/guard.unit.json",
   "position": {
    "x": 76,
    "y": 91
   },
   "equipment": []
  },
  {
   "id": "warden",
   "unit": "units/site-warden.unit.json",
   "position": {
    "x": 93,
    "y": 85
   },
   "equipment": [
    "equipment/scatter-emitter.equipment.json"
   ],
   "patrol": [
    {
     "x": 93,
     "y": 85
    },
    {
     "x": 89,
     "y": 85
    }
   ]
  }
 ],
 "objectives": [
  {
   "id": "hold-position",
   "type": "hold",
   "targetZone": "uplink-hold",
   "holdSeconds": 40,
   "required": true,
   "description": "Hold the marked position for 40 seconds."
  },
  {
   "id": "fall-back",
   "type": "extract",
   "targetZone": "fall-back-area",
   "required": true,
   "description": "Fall back to the marked landing area with the whole team."
  }
 ],
 "bystanders": [
  {
   "id": "civilian-1",
   "unit": "units/civilian-woman.unit.json",
   "position": {
    "x": 41,
    "y": 52
   },
   "equipment": [],
   "patrol": [
    {
     "x": 41,
     "y": 52
    },
    {
     "x": 32,
     "y": 52
    }
   ]
  },
  {
   "id": "civilian-2",
   "unit": "units/civilian-man.unit.json",
   "position": {
    "x": 15,
    "y": 50
   },
   "equipment": [],
   "patrol": [
    {
     "x": 15,
     "y": 50
    },
    {
     "x": 22,
     "y": 50
    }
   ]
  },
  {
   "id": "civilian-3",
   "unit": "units/civilian-woman.unit.json",
   "position": {
    "x": 74,
    "y": 52
   },
   "equipment": [],
   "patrol": [
    {
     "x": 74,
     "y": 52
    },
    {
     "x": 81,
     "y": 52
    }
   ]
  },
  {
   "id": "civilian-4",
   "unit": "units/civilian-woman.unit.json",
   "position": {
    "x": 104,
    "y": 53
   },
   "equipment": [],
   "patrol": [
    {
     "x": 104,
     "y": 53
    },
    {
     "x": 104,
     "y": 65
    }
   ]
  },
  {
   "id": "civilian-5",
   "unit": "units/civilian-woman.unit.json",
   "position": {
    "x": 65,
    "y": 3
   },
   "equipment": [],
   "patrol": [
    {
     "x": 65,
     "y": 3
    },
    {
     "x": 65,
     "y": 15
    }
   ]
  },
  {
   "id": "civilian-6",
   "unit": "units/civilian-man.unit.json",
   "position": {
    "x": 64,
    "y": 27
   },
   "equipment": [],
   "patrol": [
    {
     "x": 64,
     "y": 27
    },
    {
     "x": 64,
     "y": 15
    }
   ]
  },
  {
   "id": "civilian-7",
   "unit": "units/civilian-woman.unit.json",
   "position": {
    "x": 65,
    "y": 77
   },
   "equipment": [],
   "patrol": [
    {
     "x": 65,
     "y": 77
    },
    {
     "x": 58,
     "y": 77
    }
   ]
  },
  {
   "id": "civilian-8",
   "unit": "units/civilian-woman.unit.json",
   "position": {
    "x": 63,
    "y": 89
   },
   "equipment": [],
   "patrol": [
    {
     "x": 63,
     "y": 89
    },
    {
     "x": 63,
     "y": 83
    }
   ]
  },
  {
   "id": "civilian-9",
   "unit": "units/civilian-woman.unit.json",
   "position": {
    "x": 63,
    "y": 55
   },
   "equipment": [],
   "patrol": [
    {
     "x": 63,
     "y": 55
    },
    {
     "x": 56,
     "y": 55
    }
   ]
  },
  {
   "id": "civilian-10",
   "unit": "units/civilian-man.unit.json",
   "position": {
    "x": 62,
    "y": 79
   },
   "equipment": [],
   "patrol": [
    {
     "x": 62,
     "y": 79
    },
    {
     "x": 52,
     "y": 79
    }
   ]
  },
  {
   "id": "police-1",
   "unit": "units/city-police.unit.json",
   "position": {
    "x": 62,
    "y": 2
   },
   "equipment": [],
   "patrol": [
    {
     "x": 62,
     "y": 2
    },
    {
     "x": 56,
     "y": 2
    }
   ]
  },
  {
   "id": "police-2",
   "unit": "units/city-police.unit.json",
   "position": {
    "x": 34,
    "y": 52
   },
   "equipment": [],
   "patrol": [
    {
     "x": 34,
     "y": 52
    },
    {
     "x": 34,
     "y": 46
    }
   ]
  },
  {
   "id": "police-3",
   "unit": "units/city-police.unit.json",
   "position": {
    "x": 62,
    "y": 83
   },
   "equipment": [],
   "patrol": [
    {
     "x": 62,
     "y": 83
    },
    {
     "x": 55,
     "y": 83
    }
   ]
  },
  {
   "id": "criminal-1",
   "unit": "units/criminal.unit.json",
   "position": {
    "x": 77,
    "y": 32
   },
   "equipment": [],
   "patrol": [
    {
     "x": 77,
     "y": 32
    },
    {
     "x": 77,
     "y": 39
    }
   ]
  },
  {
   "id": "criminal-2",
   "unit": "units/criminal.unit.json",
   "position": {
    "x": 28,
    "y": 51
   },
   "equipment": [],
   "patrol": [
    {
     "x": 28,
     "y": 51
    },
    {
     "x": 28,
     "y": 63
    }
   ]
  },
  {
   "id": "criminal-3",
   "unit": "units/criminal.unit.json",
   "position": {
    "x": 42,
    "y": 90
   },
   "equipment": [],
   "patrol": [
    {
     "x": 42,
     "y": 90
    },
    {
     "x": 46,
     "y": 90
    }
   ]
  }
 ],
 "region": {
  "name": "Iberia",
  "lon": -4,
  "lat": 40,
  "population": 3500000
 },
 "vehicles": [
  {
   "id": "city-car-1",
   "vehicle": "vehicles/city-car.vehicle.json",
   "position": {
    "x": 2,
    "y": 52
   },
   "driver": "units/civilian-man.unit.json",
   "patrol": [
    {
     "x": 2,
     "y": 52
    },
    {
     "x": 52,
     "y": 52
    }
   ]
  },
  {
   "id": "city-car-2",
   "vehicle": "vehicles/city-car.vehicle.json",
   "position": {
    "x": 75,
    "y": 51
   },
   "driver": "units/civilian-woman.unit.json",
   "patrol": [
    {
     "x": 75,
     "y": 51
    },
    {
     "x": 125,
     "y": 51
    }
   ]
  },
  {
   "id": "city-car-3",
   "vehicle": "vehicles/city-car.vehicle.json",
   "position": {
    "x": 2,
    "y": 50
   },
   "driver": "units/civilian-man.unit.json",
   "patrol": [
    {
     "x": 2,
     "y": 50
    },
    {
     "x": 52,
     "y": 50
    }
   ]
  },
  {
   "id": "city-car-4",
   "vehicle": "vehicles/city-car.vehicle.json",
   "position": {
    "x": 75,
    "y": 52
   },
   "driver": "units/civilian-woman.unit.json",
   "patrol": [
    {
     "x": 75,
     "y": 52
    },
    {
     "x": 125,
     "y": 52
    }
   ]
  },
  {
   "id": "city-car-5",
   "vehicle": "vehicles/patrol-car.vehicle.json",
   "position": {
    "x": 75,
    "y": 53
   },
   "driver": "units/civilian-man.unit.json",
   "patrol": [
    {
     "x": 75,
     "y": 53
    },
    {
     "x": 125,
     "y": 53
    }
   ]
  }
 ],
 "variant": "defence",
 "territory": "developer.op-iberia",
 "title": "Hold the district",
 "briefing": "Corvid Combine is moving on Iberia. Its agents are coming for the marked position: hold it for 40 seconds while they close in, then fall back to the landing area.",
 "story": "Iberia Defence: Corvid Combine wants the district and has sent its agents. Hold the line until they give up.",
 "debrief": {
  "success": "Corvid Combine pulls back from Iberia. The district stays yours.",
  "failure": "The line broke. Corvid Combine presses on, and Iberia falls to it unless the next attempt holds."
 },
 "zones": [
  {
   "id": "fall-back-area",
   "kind": "exit",
   "position": {
    "x": 0,
    "y": 50
   },
   "width": 4,
   "height": 4
  }
 ],
 "intel": [
  "Patrol survey: Corvid Combine sends 3 of its 5 agents at the position, the nearest first.",
  "Full survey: guards and police stay on their beats but will join a fight."
 ]
}
