{
 "formatVersion": 1,
 "id": "developer.op-gulf-of-guinea-defence",
 "name": "Gulf of Guinea Audit Defence",
 "license": "CC0-1.0",
 "map": "maps/gulf-of-guinea.map.json",
 "team": [
  {
   "id": "operator-one",
   "unit": "units/field-operator.unit.json",
   "position": {
    "x": 2,
    "y": 64
   },
   "equipment": [
    "equipment/civic-pulse-emitter.equipment.json",
    "equipment/field-repair-kit.equipment.json"
   ]
  },
  {
   "id": "operator-two",
   "unit": "units/field-operator.unit.json",
   "position": {
    "x": 3,
    "y": 64
   },
   "equipment": [
    "equipment/civic-pulse-emitter.equipment.json",
    "equipment/field-repair-kit.equipment.json"
   ]
  },
  {
   "id": "operator-three",
   "unit": "units/field-operator.unit.json",
   "position": {
    "x": 2,
    "y": 65
   },
   "equipment": [
    "equipment/civic-pulse-emitter.equipment.json",
    "equipment/field-repair-kit.equipment.json"
   ]
  },
  {
   "id": "operator-four",
   "unit": "units/field-operator.unit.json",
   "position": {
    "x": 3,
    "y": 65
   },
   "equipment": [
    "equipment/civic-pulse-emitter.equipment.json",
    "equipment/field-repair-kit.equipment.json"
   ]
  }
 ],
 "opponents": [
  {
   "id": "enemy-agent-one",
   "unit": "units/enemy-agent.unit.json",
   "position": {
    "x": 48,
    "y": 80
   },
   "equipment": [],
   "patrol": [
    {
     "x": 48,
     "y": 80
    },
    {
     "x": 78,
     "y": 32
    }
   ]
  },
  {
   "id": "enemy-agent-two",
   "unit": "units/enemy-agent.unit.json",
   "position": {
    "x": 91,
    "y": 63
   },
   "equipment": [],
   "patrol": [
    {
     "x": 91,
     "y": 63
    },
    {
     "x": 78,
     "y": 32
    }
   ]
  },
  {
   "id": "enemy-agent-three",
   "unit": "units/enemy-agent.unit.json",
   "position": {
    "x": 17,
    "y": 94
   },
   "equipment": [],
   "patrol": [
    {
     "x": 17,
     "y": 94
    },
    {
     "x": 24,
     "y": 94
    }
   ]
  },
  {
   "id": "enemy-agent-four",
   "unit": "units/enemy-agent.unit.json",
   "position": {
    "x": 35,
    "y": 63
   },
   "equipment": [],
   "patrol": [
    {
     "x": 35,
     "y": 63
    },
    {
     "x": 78,
     "y": 32
    }
   ]
  },
  {
   "id": "enemy-agent-five",
   "unit": "units/enemy-agent.unit.json",
   "position": {
    "x": 41,
    "y": 79
   },
   "equipment": [],
   "patrol": [
    {
     "x": 41,
     "y": 79
    },
    {
     "x": 41,
     "y": 71
    }
   ]
  },
  {
   "id": "guard-1",
   "unit": "units/guard.unit.json",
   "position": {
    "x": 124,
    "y": 70
   },
   "equipment": []
  },
  {
   "id": "guard-2",
   "unit": "units/guard.unit.json",
   "position": {
    "x": 30,
    "y": 80
   },
   "equipment": []
  },
  {
   "id": "warden",
   "unit": "units/site-warden.unit.json",
   "position": {
    "x": 82,
    "y": 88
   },
   "equipment": [
    "equipment/scatter-emitter.equipment.json"
   ],
   "patrol": [
    {
     "x": 82,
     "y": 88
    },
    {
     "x": 82,
     "y": 84
    }
   ]
  }
 ],
 "objectives": [
  {
   "id": "hold-position",
   "type": "hold",
   "targetZone": "uplink-hold",
   "holdSeconds": 40,
   "required": true,
   "description": "Hold the marked position for 40 seconds."
  },
  {
   "id": "fall-back",
   "type": "extract",
   "targetZone": "fall-back-area",
   "required": true,
   "description": "Fall back to the marked landing area with the whole team."
  }
 ],
 "bystanders": [
  {
   "id": "civilian-1",
   "unit": "units/civilian-woman.unit.json",
   "position": {
    "x": 31,
    "y": 62
   },
   "equipment": [],
   "patrol": [
    {
     "x": 31,
     "y": 62
    },
    {
     "x": 31,
     "y": 51
    }
   ]
  },
  {
   "id": "civilian-2",
   "unit": "units/civilian-man.unit.json",
   "position": {
    "x": 118,
    "y": 65
   },
   "equipment": [],
   "patrol": [
    {
     "x": 118,
     "y": 65
    },
    {
     "x": 118,
     "y": 51
    }
   ]
  },
  {
   "id": "civilian-3",
   "unit": "units/civilian-woman.unit.json",
   "position": {
    "x": 82,
    "y": 64
   },
   "equipment": [],
   "patrol": [
    {
     "x": 82,
     "y": 64
    },
    {
     "x": 82,
     "y": 52
    }
   ]
  },
  {
   "id": "civilian-4",
   "unit": "units/civilian-man.unit.json",
   "position": {
    "x": 108,
    "y": 62
   },
   "equipment": [],
   "patrol": [
    {
     "x": 108,
     "y": 62
    },
    {
     "x": 95,
     "y": 62
    }
   ]
  },
  {
   "id": "civilian-5",
   "unit": "units/civilian-woman.unit.json",
   "position": {
    "x": 72,
    "y": 62
   },
   "equipment": [],
   "patrol": [
    {
     "x": 72,
     "y": 62
    },
    {
     "x": 59,
     "y": 62
    }
   ]
  },
  {
   "id": "civilian-6",
   "unit": "units/civilian-man.unit.json",
   "position": {
    "x": 65,
    "y": 64
   },
   "equipment": [],
   "patrol": [
    {
     "x": 65,
     "y": 64
    },
    {
     "x": 65,
     "y": 56
    }
   ]
  },
  {
   "id": "civilian-7",
   "unit": "units/civilian-woman.unit.json",
   "position": {
    "x": 61,
    "y": 65
   },
   "equipment": [],
   "patrol": [
    {
     "x": 61,
     "y": 65
    },
    {
     "x": 68,
     "y": 65
    }
   ]
  },
  {
   "id": "civilian-8",
   "unit": "units/civilian-man.unit.json",
   "position": {
    "x": 50,
    "y": 63
   },
   "equipment": [],
   "patrol": [
    {
     "x": 50,
     "y": 63
    },
    {
     "x": 50,
     "y": 70
    }
   ]
  },
  {
   "id": "civilian-9",
   "unit": "units/civilian-woman.unit.json",
   "position": {
    "x": 28,
    "y": 64
   },
   "equipment": [],
   "patrol": [
    {
     "x": 28,
     "y": 64
    },
    {
     "x": 28,
     "y": 73
    }
   ]
  },
  {
   "id": "civilian-10",
   "unit": "units/civilian-man.unit.json",
   "position": {
    "x": 97,
    "y": 64
   },
   "equipment": [],
   "patrol": [
    {
     "x": 97,
     "y": 64
    },
    {
     "x": 105,
     "y": 64
    }
   ]
  },
  {
   "id": "police-1",
   "unit": "units/city-police.unit.json",
   "position": {
    "x": 20,
    "y": 65
   },
   "equipment": [],
   "patrol": [
    {
     "x": 20,
     "y": 65
    },
    {
     "x": 20,
     "y": 73
    }
   ]
  },
  {
   "id": "police-2",
   "unit": "units/city-police.unit.json",
   "position": {
    "x": 39,
    "y": 63
   },
   "equipment": [],
   "patrol": [
    {
     "x": 39,
     "y": 63
    },
    {
     "x": 39,
     "y": 70
    }
   ]
  },
  {
   "id": "police-3",
   "unit": "units/city-police.unit.json",
   "position": {
    "x": 48,
    "y": 65
   },
   "equipment": [],
   "patrol": [
    {
     "x": 48,
     "y": 65
    },
    {
     "x": 48,
     "y": 55
    }
   ]
  },
  {
   "id": "criminal-1",
   "unit": "units/criminal.unit.json",
   "position": {
    "x": 86,
    "y": 17
   },
   "equipment": [],
   "patrol": [
    {
     "x": 86,
     "y": 17
    },
    {
     "x": 86,
     "y": 9
    }
   ]
  },
  {
   "id": "criminal-2",
   "unit": "units/criminal.unit.json",
   "position": {
    "x": 20,
    "y": 34
   },
   "equipment": [],
   "patrol": [
    {
     "x": 20,
     "y": 34
    },
    {
     "x": 20,
     "y": 40
    }
   ]
  },
  {
   "id": "criminal-3",
   "unit": "units/criminal.unit.json",
   "position": {
    "x": 73,
    "y": 93
   },
   "equipment": [],
   "patrol": [
    {
     "x": 73,
     "y": 93
    },
    {
     "x": 64,
     "y": 93
    }
   ]
  }
 ],
 "region": {
  "name": "Gulf of Guinea",
  "lon": -3,
  "lat": 7,
  "population": 3600000
 },
 "vehicles": [
  {
   "id": "city-car-1",
   "vehicle": "vehicles/city-car.vehicle.json",
   "position": {
    "x": 2,
    "y": 64
   },
   "driver": "units/civilian-man.unit.json",
   "patrol": [
    {
     "x": 2,
     "y": 64
    },
    {
     "x": 125,
     "y": 64
    }
   ]
  },
  {
   "id": "city-car-2",
   "vehicle": "vehicles/city-car.vehicle.json",
   "position": {
    "x": 58,
    "y": 65
   },
   "driver": "units/civilian-woman.unit.json",
   "patrol": [
    {
     "x": 58,
     "y": 65
    },
    {
     "x": 125,
     "y": 65
    }
   ]
  },
  {
   "id": "city-car-3",
   "vehicle": "vehicles/city-car.vehicle.json",
   "position": {
    "x": 2,
    "y": 62
   },
   "driver": "units/civilian-man.unit.json",
   "patrol": [
    {
     "x": 2,
     "y": 62
    },
    {
     "x": 125,
     "y": 62
    }
   ]
  },
  {
   "id": "city-car-4",
   "vehicle": "vehicles/city-car.vehicle.json",
   "position": {
    "x": 2,
    "y": 65
   },
   "driver": "units/civilian-woman.unit.json",
   "patrol": [
    {
     "x": 2,
     "y": 65
    },
    {
     "x": 51,
     "y": 65
    }
   ]
  },
  {
   "id": "city-car-5",
   "vehicle": "vehicles/patrol-car.vehicle.json",
   "position": {
    "x": 2,
    "y": 63
   },
   "driver": "units/civilian-man.unit.json",
   "patrol": [
    {
     "x": 2,
     "y": 63
    },
    {
     "x": 125,
     "y": 63
    }
   ]
  }
 ],
 "variant": "defence",
 "territory": "developer.op-gulf-of-guinea",
 "title": "Hold the district",
 "briefing": "Halcyon Group is moving on Gulf of Guinea. Its agents are coming for the marked position: hold it for 40 seconds while they close in, then fall back to the landing area.",
 "story": "Gulf of Guinea Defence: Halcyon Group wants the district and has sent its agents. Hold the line until they give up.",
 "debrief": {
  "success": "Halcyon Group pulls back from Gulf of Guinea. The district stays yours.",
  "failure": "The line broke. Halcyon Group presses on, and Gulf of Guinea falls to it unless the next attempt holds."
 },
 "zones": [
  {
   "id": "fall-back-area",
   "kind": "exit",
   "position": {
    "x": 0,
    "y": 62
   },
   "width": 4,
   "height": 4
  }
 ],
 "intel": [
  "Patrol survey: Halcyon Group sends 3 of its 5 agents at the position, the nearest first.",
  "Full survey: guards and police stay on their beats but will join a fight."
 ]
}
