{
 "formatVersion": 1,
 "id": "developer.op-northern-ireland-defence",
 "name": "Northern Ireland Blackout Defence",
 "license": "CC0-1.0",
 "map": "maps/northern-ireland.map.json",
 "team": [
  {
   "id": "operator-one",
   "unit": "units/field-operator.unit.json",
   "position": {
    "x": 2,
    "y": 48
   },
   "equipment": [
    "equipment/civic-pulse-emitter.equipment.json",
    "equipment/field-repair-kit.equipment.json"
   ]
  },
  {
   "id": "operator-two",
   "unit": "units/field-operator.unit.json",
   "position": {
    "x": 3,
    "y": 48
   },
   "equipment": [
    "equipment/civic-pulse-emitter.equipment.json",
    "equipment/field-repair-kit.equipment.json"
   ]
  },
  {
   "id": "operator-three",
   "unit": "units/field-operator.unit.json",
   "position": {
    "x": 2,
    "y": 49
   },
   "equipment": [
    "equipment/civic-pulse-emitter.equipment.json",
    "equipment/field-repair-kit.equipment.json"
   ]
  },
  {
   "id": "operator-four",
   "unit": "units/field-operator.unit.json",
   "position": {
    "x": 3,
    "y": 49
   },
   "equipment": [
    "equipment/civic-pulse-emitter.equipment.json",
    "equipment/field-repair-kit.equipment.json"
   ]
  }
 ],
 "opponents": [
  {
   "id": "enemy-agent-one",
   "unit": "units/enemy-agent.unit.json",
   "position": {
    "x": 33,
    "y": 90
   },
   "equipment": [],
   "patrol": [
    {
     "x": 33,
     "y": 90
    },
    {
     "x": 41,
     "y": 90
    }
   ]
  },
  {
   "id": "enemy-agent-two",
   "unit": "units/enemy-agent.unit.json",
   "position": {
    "x": 56,
    "y": 47
   },
   "equipment": [],
   "patrol": [
    {
     "x": 56,
     "y": 47
    },
    {
     "x": 105,
     "y": 17
    }
   ]
  },
  {
   "id": "enemy-agent-three",
   "unit": "units/enemy-agent.unit.json",
   "position": {
    "x": 123,
    "y": 51
   },
   "equipment": [],
   "patrol": [
    {
     "x": 123,
     "y": 51
    },
    {
     "x": 105,
     "y": 17
    }
   ]
  },
  {
   "id": "enemy-agent-four",
   "unit": "units/enemy-agent.unit.json",
   "position": {
    "x": 41,
    "y": 48
   },
   "equipment": [
    "equipment/field-repair-kit.equipment.json"
   ],
   "patrol": [
    {
     "x": 41,
     "y": 48
    },
    {
     "x": 34,
     "y": 48
    }
   ]
  },
  {
   "id": "enemy-agent-five",
   "unit": "units/enemy-agent.unit.json",
   "position": {
    "x": 60,
    "y": 56
   },
   "equipment": [],
   "patrol": [
    {
     "x": 60,
     "y": 56
    },
    {
     "x": 105,
     "y": 17
    }
   ]
  },
  {
   "id": "guard-1",
   "unit": "units/guard.unit.json",
   "position": {
    "x": 111,
    "y": 18
   },
   "equipment": []
  },
  {
   "id": "guard-2",
   "unit": "units/guard.unit.json",
   "position": {
    "x": 66,
    "y": 48
   },
   "equipment": []
  },
  {
   "id": "warden",
   "unit": "units/site-warden.unit.json",
   "position": {
    "x": 113,
    "y": 95
   },
   "equipment": [
    "equipment/scatter-emitter.equipment.json"
   ],
   "patrol": [
    {
     "x": 113,
     "y": 95
    },
    {
     "x": 117,
     "y": 95
    }
   ]
  }
 ],
 "objectives": [
  {
   "id": "hold-position",
   "type": "hold",
   "targetZone": "uplink-hold",
   "holdSeconds": 40,
   "required": true,
   "description": "Hold the marked position for 40 seconds."
  },
  {
   "id": "fall-back",
   "type": "extract",
   "targetZone": "fall-back-area",
   "required": true,
   "description": "Fall back to the marked landing area with the whole team."
  }
 ],
 "bystanders": [
  {
   "id": "civilian-1",
   "unit": "units/civilian-woman.unit.json",
   "position": {
    "x": 110,
    "y": 47
   },
   "equipment": [],
   "patrol": [
    {
     "x": 110,
     "y": 47
    },
    {
     "x": 102,
     "y": 47
    }
   ]
  },
  {
   "id": "civilian-2",
   "unit": "units/civilian-man.unit.json",
   "position": {
    "x": 61,
    "y": 48
   },
   "equipment": [],
   "patrol": [
    {
     "x": 61,
     "y": 48
    },
    {
     "x": 61,
     "y": 44
    }
   ]
  },
  {
   "id": "civilian-3",
   "unit": "units/civilian-woman.unit.json",
   "position": {
    "x": 37,
    "y": 48
   },
   "equipment": [],
   "patrol": [
    {
     "x": 37,
     "y": 48
    },
    {
     "x": 27,
     "y": 48
    }
   ]
  },
  {
   "id": "civilian-4",
   "unit": "units/civilian-man.unit.json",
   "position": {
    "x": 91,
    "y": 49
   },
   "equipment": [],
   "patrol": [
    {
     "x": 91,
     "y": 49
    },
    {
     "x": 81,
     "y": 49
    }
   ]
  },
  {
   "id": "civilian-5",
   "unit": "units/civilian-woman.unit.json",
   "position": {
    "x": 33,
    "y": 46
   },
   "equipment": [],
   "patrol": [
    {
     "x": 33,
     "y": 46
    },
    {
     "x": 39,
     "y": 46
    }
   ]
  },
  {
   "id": "civilian-6",
   "unit": "units/civilian-man.unit.json",
   "position": {
    "x": 71,
    "y": 46
   },
   "equipment": [],
   "patrol": [
    {
     "x": 71,
     "y": 46
    },
    {
     "x": 71,
     "y": 54
    }
   ]
  },
  {
   "id": "civilian-7",
   "unit": "units/civilian-woman.unit.json",
   "position": {
    "x": 20,
    "y": 47
   },
   "equipment": [],
   "patrol": [
    {
     "x": 20,
     "y": 47
    },
    {
     "x": 11,
     "y": 47
    }
   ]
  },
  {
   "id": "civilian-8",
   "unit": "units/civilian-man.unit.json",
   "position": {
    "x": 95,
    "y": 49
   },
   "equipment": [],
   "patrol": [
    {
     "x": 95,
     "y": 49
    },
    {
     "x": 81,
     "y": 49
    }
   ]
  },
  {
   "id": "civilian-9",
   "unit": "units/civilian-woman.unit.json",
   "position": {
    "x": 17,
    "y": 46
   },
   "equipment": [],
   "patrol": [
    {
     "x": 17,
     "y": 46
    },
    {
     "x": 8,
     "y": 46
    }
   ]
  },
  {
   "id": "civilian-10",
   "unit": "units/civilian-man.unit.json",
   "position": {
    "x": 102,
    "y": 47
   },
   "equipment": [],
   "patrol": [
    {
     "x": 102,
     "y": 47
    },
    {
     "x": 115,
     "y": 47
    }
   ]
  },
  {
   "id": "police-1",
   "unit": "units/city-police.unit.json",
   "position": {
    "x": 70,
    "y": 49
   },
   "equipment": [],
   "patrol": [
    {
     "x": 70,
     "y": 49
    },
    {
     "x": 70,
     "y": 38
    }
   ]
  },
  {
   "id": "police-2",
   "unit": "units/city-police.unit.json",
   "position": {
    "x": 104,
    "y": 49
   },
   "equipment": [],
   "patrol": [
    {
     "x": 104,
     "y": 49
    },
    {
     "x": 94,
     "y": 49
    }
   ]
  },
  {
   "id": "police-3",
   "unit": "units/city-police.unit.json",
   "position": {
    "x": 126,
    "y": 49
   },
   "equipment": [],
   "patrol": [
    {
     "x": 126,
     "y": 49
    },
    {
     "x": 126,
     "y": 60
    }
   ]
  },
  {
   "id": "criminal-1",
   "unit": "units/criminal.unit.json",
   "position": {
    "x": 32,
    "y": 31
   },
   "equipment": [],
   "patrol": [
    {
     "x": 32,
     "y": 31
    },
    {
     "x": 32,
     "y": 38
    }
   ]
  },
  {
   "id": "criminal-2",
   "unit": "units/criminal.unit.json",
   "position": {
    "x": 48,
    "y": 67
   },
   "equipment": [],
   "patrol": [
    {
     "x": 48,
     "y": 67
    },
    {
     "x": 37,
     "y": 67
    }
   ]
  },
  {
   "id": "criminal-3",
   "unit": "units/criminal.unit.json",
   "position": {
    "x": 2,
    "y": 14
   },
   "equipment": [],
   "patrol": [
    {
     "x": 2,
     "y": 14
    },
    {
     "x": 11,
     "y": 14
    }
   ]
  }
 ],
 "region": {
  "name": "Northern Ireland",
  "lon": -6.5,
  "lat": 54.6,
  "population": 1900000
 },
 "vehicles": [
  {
   "id": "city-car-1",
   "vehicle": "vehicles/city-car.vehicle.json",
   "position": {
    "x": 2,
    "y": 49
   },
   "driver": "units/civilian-man.unit.json",
   "patrol": [
    {
     "x": 2,
     "y": 49
    },
    {
     "x": 39,
     "y": 49
    }
   ]
  },
  {
   "id": "city-car-2",
   "vehicle": "vehicles/city-car.vehicle.json",
   "position": {
    "x": 2,
    "y": 46
   },
   "driver": "units/civilian-woman.unit.json",
   "patrol": [
    {
     "x": 2,
     "y": 46
    },
    {
     "x": 39,
     "y": 46
    }
   ]
  },
  {
   "id": "city-car-3",
   "vehicle": "vehicles/city-car.vehicle.json",
   "position": {
    "x": 47,
    "y": 49
   },
   "driver": "units/civilian-man.unit.json",
   "patrol": [
    {
     "x": 47,
     "y": 49
    },
    {
     "x": 82,
     "y": 49
    }
   ]
  },
  {
   "id": "city-car-4",
   "vehicle": "vehicles/city-car.vehicle.json",
   "position": {
    "x": 2,
    "y": 47
   },
   "driver": "units/civilian-woman.unit.json",
   "patrol": [
    {
     "x": 2,
     "y": 47
    },
    {
     "x": 39,
     "y": 47
    }
   ]
  },
  {
   "id": "city-car-5",
   "vehicle": "vehicles/patrol-car.vehicle.json",
   "position": {
    "x": 47,
    "y": 48
   },
   "driver": "units/civilian-man.unit.json",
   "patrol": [
    {
     "x": 47,
     "y": 48
    },
    {
     "x": 82,
     "y": 48
    }
   ]
  }
 ],
 "variant": "defence",
 "territory": "developer.op-northern-ireland",
 "title": "Hold the district",
 "briefing": "Tidewater Consortium is moving on Northern Ireland. Its agents are coming for the marked position: hold it for 40 seconds while they close in, then fall back to the landing area.",
 "story": "Northern Ireland Defence: Tidewater Consortium wants the district and has sent its agents. Hold the line until they give up.",
 "debrief": {
  "success": "Tidewater Consortium pulls back from Northern Ireland. The district stays yours.",
  "failure": "The line broke. Tidewater Consortium presses on, and Northern Ireland falls to it unless the next attempt holds."
 },
 "zones": [
  {
   "id": "fall-back-area",
   "kind": "exit",
   "position": {
    "x": 0,
    "y": 46
   },
   "width": 4,
   "height": 4
  }
 ],
 "intel": [
  "Patrol survey: Tidewater Consortium sends 3 of its 5 agents at the position, the nearest first.",
  "Full survey: guards and police stay on their beats but will join a fight."
 ]
}
