{
 "formatVersion": 1,
 "id": "developer.op-balkans-uprising",
 "name": "Balkans Uplink Uprising",
 "license": "CC0-1.0",
 "map": "maps/balkans.map.json",
 "team": [
  {
   "id": "operator-one",
   "unit": "units/field-operator.unit.json",
   "position": {
    "x": 2,
    "y": 48
   },
   "equipment": [
    "equipment/civic-pulse-emitter.equipment.json",
    "equipment/field-repair-kit.equipment.json"
   ]
  },
  {
   "id": "operator-two",
   "unit": "units/field-operator.unit.json",
   "position": {
    "x": 3,
    "y": 48
   },
   "equipment": [
    "equipment/civic-pulse-emitter.equipment.json",
    "equipment/field-repair-kit.equipment.json"
   ]
  },
  {
   "id": "operator-three",
   "unit": "units/field-operator.unit.json",
   "position": {
    "x": 2,
    "y": 49
   },
   "equipment": [
    "equipment/civic-pulse-emitter.equipment.json",
    "equipment/field-repair-kit.equipment.json"
   ]
  },
  {
   "id": "operator-four",
   "unit": "units/field-operator.unit.json",
   "position": {
    "x": 3,
    "y": 49
   },
   "equipment": [
    "equipment/civic-pulse-emitter.equipment.json",
    "equipment/field-repair-kit.equipment.json"
   ]
  }
 ],
 "opponents": [
  {
   "id": "enemy-agent-one",
   "unit": "units/enemy-agent.unit.json",
   "position": {
    "x": 59,
    "y": 62
   },
   "equipment": [],
   "patrol": [
    {
     "x": 59,
     "y": 62
    },
    {
     "x": 59,
     "y": 66
    }
   ]
  },
  {
   "id": "enemy-agent-two",
   "unit": "units/enemy-agent.unit.json",
   "position": {
    "x": 70,
    "y": 92
   },
   "equipment": [],
   "patrol": [
    {
     "x": 70,
     "y": 92
    },
    {
     "x": 64,
     "y": 92
    }
   ]
  },
  {
   "id": "enemy-agent-three",
   "unit": "units/enemy-agent.unit.json",
   "position": {
    "x": 82,
    "y": 5
   },
   "equipment": [],
   "patrol": [
    {
     "x": 82,
     "y": 5
    },
    {
     "x": 75,
     "y": 5
    }
   ]
  },
  {
   "id": "enemy-agent-four",
   "unit": "units/enemy-agent.unit.json",
   "position": {
    "x": 49,
    "y": 24
   },
   "equipment": [],
   "patrol": [
    {
     "x": 49,
     "y": 24
    },
    {
     "x": 49,
     "y": 30
    }
   ]
  },
  {
   "id": "enemy-agent-five",
   "unit": "units/enemy-agent.unit.json",
   "position": {
    "x": 64,
    "y": 59
   },
   "equipment": [],
   "patrol": [
    {
     "x": 64,
     "y": 59
    },
    {
     "x": 57,
     "y": 59
    }
   ]
  },
  {
   "id": "guard-1",
   "unit": "units/guard.unit.json",
   "position": {
    "x": 17,
    "y": 24
   },
   "equipment": [],
   "patrol": [
    {
     "x": 17,
     "y": 24
    },
    {
     "x": 5,
     "y": 24
    }
   ]
  },
  {
   "id": "guard-2",
   "unit": "units/guard.unit.json",
   "position": {
    "x": 90,
    "y": 72
   },
   "equipment": [],
   "patrol": [
    {
     "x": 90,
     "y": 72
    },
    {
     "x": 80,
     "y": 72
    }
   ]
  }
 ],
 "objectives": [
  {
   "id": "put-down-ringleaders",
   "type": "eliminate",
   "targets": [
    "enemy-agent-one",
    "enemy-agent-two",
    "enemy-agent-three"
   ],
   "required": true,
   "description": "Put down the 3 ringleaders."
  },
  {
   "id": "fall-back",
   "type": "extract",
   "targetZone": "fall-back-area",
   "required": true,
   "description": "Fall back to the marked landing area with the whole team."
  }
 ],
 "bystanders": [
  {
   "id": "civilian-1",
   "unit": "units/civilian-woman.unit.json",
   "position": {
    "x": 89,
    "y": 25
   },
   "equipment": [],
   "patrol": [
    {
     "x": 89,
     "y": 25
    },
    {
     "x": 95,
     "y": 25
    }
   ]
  },
  {
   "id": "civilian-2",
   "unit": "units/civilian-man.unit.json",
   "position": {
    "x": 64,
    "y": 26
   },
   "equipment": [],
   "patrol": [
    {
     "x": 64,
     "y": 26
    },
    {
     "x": 64,
     "y": 23
    }
   ]
  },
  {
   "id": "civilian-3",
   "unit": "units/civilian-woman.unit.json",
   "position": {
    "x": 49,
    "y": 43
   },
   "equipment": [],
   "patrol": [
    {
     "x": 49,
     "y": 43
    },
    {
     "x": 49,
     "y": 49
    }
   ]
  },
  {
   "id": "civilian-4",
   "unit": "units/civilian-man.unit.json",
   "position": {
    "x": 95,
    "y": 24
   },
   "equipment": [],
   "patrol": [
    {
     "x": 95,
     "y": 24
    },
    {
     "x": 88,
     "y": 24
    }
   ]
  },
  {
   "id": "civilian-5",
   "unit": "units/civilian-woman.unit.json",
   "position": {
    "x": 46,
    "y": 55
   },
   "equipment": [],
   "patrol": [
    {
     "x": 46,
     "y": 55
    },
    {
     "x": 50,
     "y": 55
    }
   ]
  },
  {
   "id": "civilian-6",
   "unit": "units/civilian-man.unit.json",
   "position": {
    "x": 57,
    "y": 92
   },
   "equipment": [],
   "patrol": [
    {
     "x": 57,
     "y": 92
    },
    {
     "x": 48,
     "y": 92
    }
   ]
  },
  {
   "id": "civilian-7",
   "unit": "units/civilian-woman.unit.json",
   "position": {
    "x": 30,
    "y": 27
   },
   "equipment": [],
   "patrol": [
    {
     "x": 30,
     "y": 27
    },
    {
     "x": 42,
     "y": 27
    }
   ]
  },
  {
   "id": "civilian-8",
   "unit": "units/civilian-man.unit.json",
   "position": {
    "x": 27,
    "y": 39
   },
   "equipment": [],
   "patrol": [
    {
     "x": 27,
     "y": 39
    },
    {
     "x": 23,
     "y": 39
    }
   ]
  },
  {
   "id": "civilian-9",
   "unit": "units/civilian-woman.unit.json",
   "position": {
    "x": 48,
    "y": 51
   },
   "equipment": [],
   "patrol": [
    {
     "x": 48,
     "y": 51
    },
    {
     "x": 48,
     "y": 45
    }
   ]
  },
  {
   "id": "civilian-10",
   "unit": "units/civilian-man.unit.json",
   "position": {
    "x": 31,
    "y": 90
   },
   "equipment": [],
   "patrol": [
    {
     "x": 31,
     "y": 90
    },
    {
     "x": 31,
     "y": 95
    }
   ]
  },
  {
   "id": "police-1",
   "unit": "units/city-police.unit.json",
   "position": {
    "x": 92,
    "y": 90
   },
   "equipment": [],
   "patrol": [
    {
     "x": 92,
     "y": 90
    },
    {
     "x": 86,
     "y": 90
    }
   ]
  },
  {
   "id": "police-2",
   "unit": "units/city-police.unit.json",
   "position": {
    "x": 90,
    "y": 30
   },
   "equipment": [],
   "patrol": [
    {
     "x": 90,
     "y": 30
    },
    {
     "x": 95,
     "y": 30
    }
   ]
  },
  {
   "id": "police-3",
   "unit": "units/city-police.unit.json",
   "position": {
    "x": 1,
    "y": 27
   },
   "equipment": [],
   "patrol": [
    {
     "x": 1,
     "y": 27
    },
    {
     "x": 1,
     "y": 37
    }
   ]
  },
  {
   "id": "criminal-1",
   "unit": "units/criminal.unit.json",
   "position": {
    "x": 75,
    "y": 34
   },
   "equipment": [],
   "patrol": [
    {
     "x": 75,
     "y": 34
    },
    {
     "x": 75,
     "y": 24
    }
   ]
  },
  {
   "id": "criminal-2",
   "unit": "units/criminal.unit.json",
   "position": {
    "x": 92,
    "y": 26
   },
   "equipment": [],
   "patrol": [
    {
     "x": 92,
     "y": 26
    },
    {
     "x": 92,
     "y": 17
    }
   ]
  },
  {
   "id": "criminal-3",
   "unit": "units/criminal.unit.json",
   "position": {
    "x": 76,
    "y": 31
   },
   "equipment": [],
   "patrol": [
    {
     "x": 76,
     "y": 31
    },
    {
     "x": 76,
     "y": 43
    }
   ]
  }
 ],
 "region": {
  "name": "Balkans",
  "lon": 22,
  "lat": 43,
  "population": 2500000
 },
 "vehicles": [
  {
   "id": "city-car-1",
   "vehicle": "vehicles/city-car.vehicle.json",
   "position": {
    "x": 35,
    "y": 49
   },
   "driver": "units/civilian-man.unit.json",
   "patrol": [
    {
     "x": 35,
     "y": 49
    },
    {
     "x": 79,
     "y": 49
    }
   ]
  },
  {
   "id": "city-car-2",
   "vehicle": "vehicles/city-car.vehicle.json",
   "position": {
    "x": 2,
    "y": 71
   },
   "driver": "units/civilian-woman.unit.json",
   "patrol": [
    {
     "x": 2,
     "y": 71
    },
    {
     "x": 93,
     "y": 71
    }
   ]
  },
  {
   "id": "city-car-3",
   "vehicle": "vehicles/city-car.vehicle.json",
   "position": {
    "x": 35,
    "y": 48
   },
   "driver": "units/civilian-man.unit.json",
   "patrol": [
    {
     "x": 35,
     "y": 48
    },
    {
     "x": 79,
     "y": 48
    }
   ]
  },
  {
   "id": "city-car-4",
   "vehicle": "vehicles/city-car.vehicle.json",
   "position": {
    "x": 2,
    "y": 90
   },
   "driver": "units/civilian-woman.unit.json",
   "patrol": [
    {
     "x": 2,
     "y": 90
    },
    {
     "x": 93,
     "y": 90
    }
   ]
  },
  {
   "id": "city-car-5",
   "vehicle": "vehicles/patrol-car.vehicle.json",
   "position": {
    "x": 2,
    "y": 69
   },
   "driver": "units/civilian-man.unit.json",
   "patrol": [
    {
     "x": 2,
     "y": 69
    },
    {
     "x": 93,
     "y": 69
    }
   ]
  },
  {
   "id": "freight-train-1",
   "vehicle": "vehicles/freight-train.vehicle.json",
   "position": {
    "x": 12,
    "y": 2
   },
   "stops": [
    {
     "x": 12,
     "y": 2,
     "wait": 0
    },
    {
     "x": 59,
     "y": 2,
     "wait": 8
    },
    {
     "x": 78,
     "y": 2,
     "wait": 6
    }
   ]
  }
 ],
 "variant": "uprising",
 "territory": "developer.op-balkans",
 "title": "The district has risen",
 "briefing": "Balkans has risen against you and pays nothing until order is restored. Put down the 3 ringleaders and fall back to the landing area. The crowds will go home once they fall.",
 "story": "Balkans Uprising: taxes too high for too long, and the streets belong to the ringleaders. End it.",
 "debrief": {
  "success": "The ringleaders are down and Balkans goes home. The district is yours again and pays tax once more.",
  "failure": "The team is lost and Balkans stays in revolt. It pays nothing until it is taken back."
 },
 "zones": [
  {
   "id": "fall-back-area",
   "kind": "exit",
   "position": {
    "x": 0,
    "y": 46
   },
   "width": 4,
   "height": 4
  }
 ],
 "intel": [
  "Patrol survey: the rising is led by 3 agents, spread through the district.",
  "Full survey: only the ringleaders count; everyone else will fight if you come near."
 ]
}
